{
  "contractVersion": 1,
  "id": "foundation",
  "name": "Foundation",
  "entry": "src/entries/foundation.main.jsx",
  "routes": "src/router/FoundationRoutes.jsx",
  "layout": "src/layouts/FoundationLayout.jsx",
  "shellCss": "src/styles/foundation.css",
  "dashboard": "src/pages/foundation/FoundationTop.jsx",
  "capabilities": {},
  "meta": {
    "generated": true,
    "createdAt": "2026-01-21T16:02:37.873Z"
  }
}
